{
  "reservationId": "5b0a6f0e-7c0d-4a0e-9a64-0c2e7f1b9a11",
  "branchId": "1f2e3d4c-0000-4000-8000-000000000001",
  "branchTimeZone": "Asia/Ho_Chi_Minh",
  "items": [
    {
      "resourceId": "c0a8012e-0000-4000-8000-0000000000aa",
      "resourceTypeId": "c0a8012e-0000-4000-8000-0000000000bb",
      "startTime": "2026-11-20T18:00:00+07:00",
      "endTime": "2026-11-20T20:00:00+07:00",
      "price": 240000
    }
  ],
  "customer": {
    "customerId": "9d3f1c2a-0000-4000-8000-000000000123",
    "isGuest": false,
    "tier": "GOLD",
    "memberSince": "2025-03-14T08:00:00+07:00",
    "history": {
      "completedCount": 12,
      "noShowCount": 1,
      "cancelledCount": 2,
      "lateCancelledCount": 1,
      "paymentExpiredCount": 0,
      "lastCompletedAt": "2026-11-02T20:00:00+07:00"
    }
  },
  "totalPrice": 228000,
  "currency": "VND",
  "channel": "ONLINE",
  "demand": { "occupancyRate": 0.75, "waitlistCount": 2 },
  "requestedAt": "2026-11-18T09:15:00+07:00",
  "metadata": { "promotionCode": "WINTER" }
}
